{
  "meta": {
    "title": "Erdős 742 · problem",
    "description": "Erdős problem 742 (Murty–Simon): statement, the claimed Lean proof under review, certificate and replay status from receipts (PARTIAL: statement audit passed, theorem did not compile, no axiom receipt → unverified), compute and host, the 30 Aug decision log, what would close it.",
    "stream": "research",
    "crumb": [
      {
        "label": "Templates",
        "href": "/"
      },
      {
        "label": "U6 · Erdős",
        "href": "/t/U6/"
      },
      {
        "label": "742"
      }
    ],
    "actions": [
      {
        "label": "erdosproblems.com/742",
        "href": "https://www.erdosproblems.com/742",
        "icon": "arrow-up-right",
        "external": true
      },
      {
        "label": "claimed proof · Erdos742/Erdos742",
        "href": "https://github.com/Erdos742/Erdos742/commit/814289f2eb4091ad39b7c456266f92cf82f38bce",
        "icon": "git-branch",
        "external": true
      }
    ],
    "source": "SISO_Research/erdos/targets/742/runs/proof-review/HANDOFF.md (30 Aug 16:22) · SISO_Research/erdos/MAC-MINI-HANDOFF-2026-08-30.md · DECISION-LOG.html · CHECKPOINT-2026-08-30.html · tasks/TASKS.json · state/project.json · audits/{easiest-targets,solver-repositories}.md · goals/review-742-proof.md · formal-conjectures-742.lean (google-deepmind, sha256 25f7c5cd…) · atlas/now.json ERDOS-LEAD · read 6 Sep 20:25 UTC+07"
  },
  "heading": {
    "breadcrumb": [
      {
        "label": "Research",
        "href": "/t/U5/"
      },
      {
        "label": "Erdős"
      },
      {
        "label": "742"
      }
    ],
    "kicker": "Erdős problem <span class=\"sep\">·</span> #742 <span class=\"sep\">·</span> <span class=\"dim\">Murty–Simon conjecture · AMS 5 · open</span>",
    "title": "Erdős 742",
    "subtitle": "A diameter-2-critical graph on <em>n</em> vertices has at most ⌊<em>n</em>²/4⌋ edges. A repository claims a complete Lean proof; SISO's review lane got the statement to match Formal Conjectures and the dependency audit to pass, and the theorem did not compile. No kernel or axiom receipt exists, so the state here is <b>unverified</b>.",
    "badges": [
      {
        "label": "research question",
        "tone": "research",
        "dot": true
      },
      {
        "label": "proof state · unverified",
        "tone": "warn",
        "href": "#certificate",
        "icon": "shield-alert"
      },
      {
        "label": "REVIEW-742 · partial",
        "tone": "warn",
        "href": "#certificate"
      },
      {
        "label": "laptop lane frozen 30 Aug",
        "tone": "blocked",
        "href": "#compute"
      },
      {
        "label": "ERDOS-LEAD · mini · idle",
        "tone": "agents",
        "href": "#fleet"
      }
    ],
    "status": {
      "kicker": "Certificate",
      "value": "none · unverified",
      "note": "HANDOFF.md 30 Aug 16:22: \"PARTIAL — the pinned source was acquired and statement/sorry reachability were audited, but the headline theorem did not compile in this environment.\" Bounded build exited 124 during dependency acquisition.",
      "facts": [
        {
          "k": "claim under review",
          "v": "<code>Erdos742/Erdos742</code> @ <code>814289f2</code> (10 Aug 2026, no licence, no lock)"
        },
        {
          "k": "statement match",
          "v": "<code>erdos_742</code> = Formal Conjectures 742 after removing <code>answer(sorry)</code>"
        },
        {
          "k": "known results",
          "v": "Fan 1987: n ≤ 24 and n = 26 · Füredi 1992: all large n (Formal Conjectures header)"
        },
        {
          "k": "first live order",
          "v": "25 (audits/easiest-targets.md)"
        },
        {
          "k": "next host",
          "v": "Mac Mini M4 (state: handoff-to-mac-mini)"
        }
      ]
    },
    "metrics": [
      {
        "value": 4,
        "label": "approach steps",
        "tone": "research",
        "href": "#approach"
      },
      {
        "value": 5,
        "label": "compute facts",
        "tone": "muted",
        "href": "#compute"
      },
      {
        "value": 5,
        "label": "decision-log lines",
        "tone": "agents",
        "href": "#decisions"
      },
      {
        "value": 4,
        "label": "repos",
        "tone": "projects",
        "href": "#repos"
      }
    ],
    "jump": [
      {
        "label": "Problem statement",
        "href": "#problem"
      },
      {
        "label": "Approach · reductions",
        "href": "#approach"
      },
      {
        "label": "Certificate · replay status",
        "href": "#certificate"
      },
      {
        "label": "Compute spent · host",
        "href": "#compute"
      },
      {
        "label": "Decision log",
        "href": "#decisions"
      },
      {
        "label": "What would close it",
        "href": "#close"
      }
    ]
  },
  "sections": {
    "problem": {
      "n": "01",
      "title": "Problem statement",
      "sub": "from the Formal Conjectures file fetched at review time (sha256 25f7c5cd…)"
    },
    "approach": {
      "n": "02",
      "title": "Approach · reductions",
      "sub": "what the fleet chose to do and why"
    },
    "certificate": {
      "n": "03",
      "title": "Certificate · replay status",
      "sub": "proof state only from a receipt; the claim ceiling of this page"
    },
    "compute": {
      "n": "04",
      "title": "Compute spent · host",
      "sub": "what is measured, what is not"
    },
    "decisions": {
      "n": "05",
      "title": "Decision log",
      "sub": "DECISION-LOG.html and CHECKPOINT-2026-08-30.html, verbatim lines as facts"
    },
    "close": {
      "n": "06",
      "title": "What would close it"
    },
    "repos": {
      "n": "07",
      "title": "Repos · certificate files",
      "sub": "the erdos workspace (inside SISO_Workspace, not a git repo of its own) and the pinned upstreams"
    },
    "fleet": {
      "n": "08",
      "title": "Fleet · seats",
      "sub": "the four problems as the 30 Aug handoff observed them"
    },
    "timeline": {
      "n": "09",
      "title": "Attempts"
    },
    "map": {
      "n": "10",
      "title": "Mind map",
      "sub": "problem → reductions → repos → gates"
    },
    "related": {
      "n": "11",
      "title": "Links out"
    },
    "agent": {
      "n": "12",
      "title": "Agent entry"
    }
  },
  "problem": {
    "statement": "<b>Murty–Simon Conjecture.</b> Let <em>G</em> be a graph on <em>n</em> vertices with diameter 2 such that deleting any edge increases the diameter. Is it true that <em>G</em> has at most ⌊<em>n</em>²/4⌋ edges? Equality is conjectured to hold for the complete balanced bipartite graph <em>K</em><sub>⌈n/2⌉,⌊n/2⌋</sub>.",
    "facts": [
      {
        "k": "formal statement",
        "v": "<code>theorem erdos_742 : answer(sorry) ↔ ∀ (V : Type*) [Fintype V] [DecidableEq V] (G : SimpleGraph V) [DecidableRel G.Adj], IsDiameter2Critical G → G.edgeFinset.card ≤ (Fintype.card V) ^ 2 / 4</code>"
      },
      {
        "k": "definition",
        "v": "<code>IsDiameter2Critical G := G.diam = 2 ∧ ∀ e ∈ G.edgeSet, (G.deleteEdges {e}).diam ≠ 2</code>"
      },
      {
        "k": "category",
        "v": "research open · AMS 5 (Formal Conjectures tag)"
      },
      {
        "k": "resolved up to",
        "v": "a finite check: Fan [Fa87] n ≤ 24 and n = 26; Füredi [Fü92] all sufficiently large n"
      },
      {
        "k": "lane brief",
        "v": "targets/742/README.md: \"audit and extend proof-logging SAT work at order 25. Preserve CNF identity, solver version, proof log, independent replay, and any decoded graph.\""
      }
    ],
    "words": [
      {
        "text": "we need one for each ERDOS question we need one for each god question we need one for each agent zero, we need one for each research doc, we need one for each project one pager",
        "who": "Shaan → AGENT-ZERO · 00_AGENT_ZERO/source/2026-09-06-1650-…",
        "at": "6 Sep 16:50"
      }
    ]
  },
  "approach": {
    "items": [
      {
        "label": "Admit 742 first as a bounded falsification/certification job",
        "what": "audits/easiest-targets.md: \"the practical frontier is one finite order (25), the SAT input and candidate checker are public, and a SAT witness would be a genuine counterexample\"",
        "state": "admitted",
        "tone": "now"
      },
      {
        "label": "Then a repository claimed a complete Lean proof",
        "what": "audits/solver-repositories.md §742: Erdos742.lean 173 KB, Equality.lean 300 KB, Erdos742Full.lean 474 KB, two papers; \"no lakefile.lean, lean-toolchain, workflow, build script, certificate manifest, or pinned dependency file\"",
        "state": "claim",
        "tone": "warn"
      },
      {
        "label": "Goal /review-742-proof",
        "what": "\"Wrap the pinned Erdos742/Erdos742 sources in the smallest reproducible Lean project, compile the headline theorem, print its transitive axioms, and determine whether any sorryAx or unstated hypothesis reaches the result.\" PASS requires a reproducible build plus statement-fidelity and axiom receipts.",
        "state": "goal",
        "tone": "research"
      },
      {
        "label": "Reusable SAT path kept",
        "what": "leansolving/leansms (Apache-2.0) MurtySimon encoder, <code>lake exe murty-simon-generate &lt;n&gt;</code>: verified CNF/LRAT impossibility proofs for finite orders; restricted LRAT classes exist upstream (edisonymy/erdos-lean-research experiments/erdos742)",
        "state": "available",
        "tone": "muted"
      }
    ],
    "steps": [
      {
        "label": "Pin",
        "what": "detached checkout at 814289f2, source sha256 recorded"
      },
      {
        "label": "Match",
        "what": "statement against Formal Conjectures 742 (fetched, sha256 recorded)"
      },
      {
        "label": "Build",